{
  "schema": "ph-manual-edit-provenance.v1",
  "schemaVersion": "1",
  "task": "TASK-A06",
  "recordedAt": "2026-09-09",
  "coordinateSpace": {
    "kind": "source-image-stack",
    "patientSpaceClaim": false,
    "ctRegistrationEstablished": false
  },
  "source": {
    "sourceFrameCount": 451,
    "sourceFilenameShaAggregate": "sha256:0c330a99eedf1a446ca6502b4a7bde12e9893e96dc75f65348cb16f32d701f48",
    "cropFilenameShaAggregate": "sha256:f6e46638ecb84a16dd20cc604931874ec36815091d050b31843392b7d73c7171",
    "candidateOutputDigest": "sha256:6a9f302ab5a1efd5d5d9c60e3c29aeee6b2082f3e04df2bcbe880e886b8b3ef4",
    "supplementalCandidateOutputs": [
      {
        "labels": [
          "radius",
          "ulna"
        ],
        "uri": "drive://1RqfSfjMtmssxnm0CJRYqgoIUeHi8rEfq/a06-support-aware-radius-ulna-v0.zip",
        "digest": "sha256:407ca0dee7ef99dca8f408195159dca377342376f873c3611b4409b264ab724b",
        "supportStatus": "partial-support-v0-candidate; avf1567a.png through avf1685c.png; outside interval unknown"
      },
      {
        "labels": [
          "ulnar_artery"
        ],
        "uri": "drive://1QR2LIlFP0OSTq4FodVGkr-o6Dpw50Krw/a06-source-evidence-vessel-candidates-v0.zip",
        "digest": "sha256:94134f3d5547597365181596511d440e21ac768b6df7a1eb8a16ea1666b72f5b",
        "supportStatus": "intermittent-v0-candidate; 157 source-supported mask frames within avf1624a.png through avf1685a.png; gaps remain unknown and human anatomical correction/review is pending"
      }
    ]
  },
  "manualCorrection": {
    "status": "pending-human-edit",
    "editorReference": null,
    "tool": null,
    "completedAt": null
  },
  "structures": [
    {
      "draftLabel": "skin",
      "status": "pending-human-edit",
      "reason": "V0 automatic candidate requires human anatomical correction/review before promotion.",
      "outputUri": null,
      "outputDigest": null
    },
    {
      "draftLabel": "subcutaneous_soft_tissue",
      "status": "pending-human-edit",
      "reason": "V0 automatic candidate requires human anatomical correction/review before promotion.",
      "outputUri": null,
      "outputDigest": null
    },
    {
      "draftLabel": "major_muscle_tendon_region",
      "status": "pending-human-edit",
      "reason": "V0 automatic candidate requires human anatomical correction/review before promotion.",
      "outputUri": null,
      "outputDigest": null
    },
    {
      "draftLabel": "radius",
      "status": "pending-human-edit",
      "reason": "Same-cadaver CT-corroborated partial-support V0 candidate is available for avf1567a.png through avf1685c.png; extent outside that interval remains unknown and human anatomical correction/review is still pending.",
      "outputUri": null,
      "outputDigest": null
    },
    {
      "draftLabel": "ulna",
      "status": "pending-human-edit",
      "reason": "Same-cadaver CT-corroborated partial-support V0 candidate is available for avf1567a.png through avf1685c.png; extent outside that interval remains unknown and human anatomical correction/review is still pending.",
      "outputUri": null,
      "outputDigest": null
    },
    {
      "draftLabel": "radial_artery",
      "status": "blocked-source-evidence",
      "reason": "Atlas-guided source-image diagnostic track failed vessel-confidence thresholds; no radial artery mask is accepted for manual correction.",
      "outputUri": null,
      "outputDigest": null
    },
    {
      "draftLabel": "ulnar_artery",
      "status": "pending-human-edit",
      "reason": "Source-image-supported intermittent V0 candidate track is available on 157 frames spanning avf1624a.png through avf1685a.png; gaps and complete extent remain unknown and human anatomical correction/review is pending.",
      "outputUri": null,
      "outputDigest": null
    },
    {
      "draftLabel": "superficial_target_vein",
      "status": "blocked-source-evidence",
      "reason": "Cephalic and basilic atlas priors are not sufficiently supported by VHP source-image tissue, so the named superficial target vein identity remains unresolved.",
      "outputUri": null,
      "outputDigest": null
    }
  ],
  "claims": {
    "humanEdited": false,
    "anatomicallyReviewed": false,
    "medicalValidation": false,
    "patientSpaceGeometry": false,
    "automaticPromotionAllowed": false
  }
}
